{"$schema":"https://json-schema.org/draft/2020-12/schema","$id":"https://example.invalid/spec/canonical-entry-v0.4.schema.json","title":"SUM-20 pilot canonical lexical entry","type":"object","required":["schema_version","dataset_id","entry_id","source","lemma","grammar","def_short","def_short_source_pointer","senses","phrases"],"additionalProperties":false,"properties":{"schema_version":{"const":"lex-entry-v0.4"},"dataset_id":{"type":"string","minLength":1},"entry_id":{"type":"string","pattern":"^sum20-hist-ap-[0-9]{3}$"},"source":{"type":"object","additionalProperties":false,"required":["raw_path","raw_sha256","source_file"],"properties":{"raw_path":{"type":"string"},"raw_sha256":{"type":"string","pattern":"^[0-9a-f]{64}$"},"source_file":{"type":"string"}}},"lemma":{"type":"object","additionalProperties":false,"required":["display","search","variants"],"properties":{"display":{"type":"string","minLength":1},"search":{"type":"string","minLength":1},"homonym_number":{"type":"integer","minimum":1},"labels_source":{"type":"array","items":{"type":"string"}},"variants":{"type":"array","items":{"$ref":"#/$defs/variant"}}}},"grammar":{"type":"object","required":["pos","pos_status"],"additionalProperties":false,"properties":{"pos":{"type":"string"},"pos_status":{"enum":["source_explicit","inferred_from_headword_morphology"]},"gender":{"type":"string"},"gender_source":{"type":"string"},"genitive_source":{"type":"string"},"aspect":{"type":"string"},"aspect_source":{"type":"string"},"inflection_source":{"type":"string"}}},"def_short":{"type":"string","minLength":1},"def_short_source_pointer":{"type":"string","pattern":"^/"},"senses":{"type":"array","minItems":1,"items":{"$ref":"#/$defs/sense"}},"phrases":{"type":"array","items":{"$ref":"#/$defs/phrase"}}},"$defs":{"variant":{"type":"object","required":["display","labels_source"],"additionalProperties":false,"properties":{"display":{"type":"string"},"labels_source":{"type":"array","items":{"type":"string"}}}},"example":{"type":"object","required":["example_id","text","source_ref"],"additionalProperties":false,"properties":{"example_id":{"type":"string"},"text":{"type":"string"},"source_ref":{"type":"string"},"labels_source":{"type":"array","items":{"type":"string"}}}},"crossref":{"type":"object","required":["relation","target_display"],"additionalProperties":false,"properties":{"relation":{"type":"string"},"target_display":{"type":"string"}}},"subsense":{"type":"object","required":["sub_sense_id","definition"],"additionalProperties":false,"properties":{"sub_sense_id":{"type":"string"},"labels_source":{"type":"array","items":{"type":"string"}},"morphology_source":{"type":"object","additionalProperties":{"type":"string"}},"definition":{"type":"string","minLength":1},"examples":{"type":"array","items":{"$ref":"#/$defs/example"}},"cross_references":{"type":"array","items":{"$ref":"#/$defs/crossref"}}}},"sense":{"type":"object","required":["sense_id","labels_source","definition","examples","cross_references"],"additionalProperties":false,"properties":{"sense_id":{"type":"string"},"labels_source":{"type":"array","items":{"type":"string"}},"morphology_source":{"type":"object","additionalProperties":{"type":"string"}},"definition":{"type":"string","minLength":1},"examples":{"type":"array","items":{"$ref":"#/$defs/example"}},"sub_senses":{"type":"array","items":{"$ref":"#/$defs/subsense"}},"cross_references":{"type":"array","items":{"$ref":"#/$defs/crossref"}}}},"phrase":{"type":"object","required":["phrase_id","display","marker_source","labels_source","definition","examples"],"additionalProperties":false,"properties":{"phrase_id":{"type":"string"},"display":{"type":"string"},"marker_source":{"type":"string"},"labels_source":{"type":"array","items":{"type":"string"}},"definition":{"type":["string","null"]},"examples":{"type":"array","items":{"$ref":"#/$defs/example"}},"sub_senses":{"type":"array","items":{"$ref":"#/$defs/subsense"}},"cross_references":{"type":"array","items":{"$ref":"#/$defs/crossref"}}}}}}
