{
  "schema_version": "lex-entry-v0.4",
  "dataset_id": "sum20-hist-ap-pilot-v0",
  "entry_id": "sum20-hist-ap-022",
  "source": {
    "raw_path": "data/pilot/raw/022-pudra.txt",
    "raw_sha256": "9d3882d855b475edeffc28fe151d7cad7acdb1c8f8aa7e4191d5bcf194b3ab10",
    "source_file": "4e21e575-8d98-4c3b-82a1-8f023a00d1ca.docx"
  },
  "lemma": {"display": "ПУ́ДРА", "search": "ПУДРА", "variants": []},
  "grammar": {"pos": "NOUN", "pos_status": "inferred_from_headword_morphology", "gender": "feminine", "gender_source": "ж.", "genitive_source": "и"},
  "def_short": "Дрібний і м'який, перев. пахучий, порошок, що наноситься на шкіру як гігієнічний або косметичний засіб.",
  "def_short_source_pointer": "/senses/0/definition",
  "senses": [
    {
      "sense_id": "sum20-hist-ap-022-s1",
      "labels_source": [],
      "definition": "Дрібний і м'який, перев. пахучий, порошок, що наноситься на шкіру як гігієнічний або косметичний засіб.",
      "examples": [
        {"example_id": "sum20-hist-ap-022-s1-e1", "text": "Присів [Карпо Петрович] біля жінки, мало не задихнувшись од солодкого запаху пудри з її лиця", "source_ref": "М. Коцюбинський"},
        {"example_id": "sum20-hist-ap-022-s1-e2", "text": "На лице поклала [Любов Прохорівна] зайвий шар пухкої пудри, щоб блідість свою на неї звернути", "source_ref": "Іван Ле"},
        {"example_id": "sum20-hist-ap-022-s1-e3", "text": "Вона прискіпливо оглянула в дзеркальце свої помальовані губи і взялася пудрити симпатичний носик французькою компактною пудрою", "source_ref": "П. Загребельний"},
        {"example_id": "sum20-hist-ap-022-s1-e4", "text": "Зі старомодного, проте все ще елегантного ридикюля, випадали різноманітні предмети: паперові носовички, .. помада, булавки, фотографія сина, французькі парфуми, червоний записничок, дзеркальце з пудрою, пінцет, копійки, жетони на метро...", "source_ref": "М. Гримич"},
        {"example_id": "sum20-hist-ap-022-s1-e5", "text": "Покритий весь дрібним, як пудра, м'яким порохом .. цей шлях, з сірим запорошеним бур'яном з боків, здається схожим на старого, змученого, знесиленого життям чоловіка", "source_ref": "В. Винниченко", "labels_source": ["* У порівн."]}
      ],
      "sub_senses": [
        {
          "sub_sense_id": "sum20-hist-ap-022-s1a",
          "labels_source": ["іст."],
          "definition": "Порошок з крохмалю або інших речовин, яким обсипали волосся та перуки.",
          "examples": [
            {"example_id": "sum20-hist-ap-022-s1a-e1", "text": "Злякано вбігає [Ліза] в широких шовках, .. пишне волосся її поблискує брильянтовою пудрою", "source_ref": "М. Стельмах"},
            {"example_id": "sum20-hist-ap-022-s1a-e2", "text": "Пишні перуки в пудрі, блискучі черевики, мережані ковніри, французькі вина", "source_ref": "Ю. Мушкетик"}
          ],
          "cross_references": []
        },
        {
          "sub_sense_id": "sum20-hist-ap-022-s1b",
          "labels_source": [],
          "definition": "Косметичний засіб для висвітлювання, матування і т. ін. волосся або укладання зачіски.",
          "examples": [
            {"example_id": "sum20-hist-ap-022-s1b-e1", "text": "Висвітлювальну пудру та окиснювач варто підбирати за типом та структурою волосся, надаючи перевагу менш агресивним засобам", "source_ref": "із журн."},
            {"example_id": "sum20-hist-ap-022-s1b-e2", "text": "Укладку короткої зачіски можна завершити пудрою, щоб надати волоссю об'єму та зафіксувати його", "source_ref": "з газ."},
            {"example_id": "sum20-hist-ap-022-s1b-e3", "text": "З пудрою ваше волосся завжди виглядатиме природним, а зачіска годинами триматиме форму та об'єм", "source_ref": "з мови реклами"}
          ],
          "cross_references": []
        }
      ],
      "cross_references": []
    }
  ],
  "phrases": [
    {
      "phrase_id": "sum20-hist-ap-022-p1",
      "display": "Цукро́ва пу́дра",
      "marker_source": "△ (1)",
      "labels_source": ["кул."],
      "definition": "Дрібно перемелений цукровий пісок.",
      "examples": [
        {"example_id": "sum20-hist-ap-022-p1-e1", "text": "Цукрову пудру використовують для виготовлення різноманітних глазурей, зефіру, безе та інших солодощів", "source_ref": "з навч. літ."},
        {"example_id": "sum20-hist-ap-022-p1-e2", "text": "Кожна гілочка на деревах була біла, наче .. обсипано кожну цукровою пудрою", "source_ref": "Ю. Яновський"},
        {"example_id": "sum20-hist-ap-022-p1-e3", "text": "Він колись поведе її до пекарні, де мелють мигдаль на борошно, додаючи трохи зерен гіркого мигдалю, лиють [ллють] в тісто трояндову воду, сиплять [сиплють] цукрову пудру, а потім, коли тісто вистоїться, ліплять з нього фігурки й припікають, щоб тісто зарум'янилося", "source_ref": "Г. Пагутяк"}
      ]
    }
  ]
}
