{
  "schema_version": "lex-entry-v0.4",
  "dataset_id": "sum20-hist-ap-pilot-v0",
  "entry_id": "sum20-hist-ap-025",
  "source": {
    "raw_path": "data/pilot/raw/025-piatyrichka.txt",
    "raw_sha256": "04dfedcad8d5411f106029184bf6044a9059b996fc09ffe0fd73883518d1d623",
    "source_file": "4e21e575-8d98-4c3b-82a1-8f023a00d1ca.docx"
  },
  "lemma": {"display": "П'ЯТИРІ́ЧКА", "search": "П'ЯТИРІЧКА", "variants": []},
  "grammar": {"pos": "NOUN", "pos_status": "inferred_from_headword_morphology", "gender": "feminine", "gender_source": "ж.", "genitive_source": "и"},
  "def_short": "П'ятирічний план розвитку народного господарства колишнього СРСР і деяких інших соціалістичних країн, а також період, охоплюваний цим планом.",
  "def_short_source_pointer": "/senses/0/definition",
  "senses": [
    {
      "sense_id": "sum20-hist-ap-025-s1",
      "labels_source": ["іст."],
      "definition": "П'ятирічний план розвитку народного господарства колишнього СРСР і деяких інших соціалістичних країн, а також період, охоплюваний цим планом.",
      "examples": [
        {"example_id": "sum20-hist-ap-025-s1-e1", "text": "– Нині інженери Петров і Каргат розробляють низку заходів, які дозволять нам ліквідувати відставання заводу від темпів п'ятирічки", "source_ref": "Ю. Шовкопляс"},
        {"example_id": "sum20-hist-ap-025-s1-e2", "text": "– Хіба сподівалися, що на другому році першої післявоєнної п'ятирічки снідатимемо отаким хлібом, – зім'яв у товстих пучках маленький шматочок глевтяка Степан Григорович", "source_ref": "Микита Чернявський"},
        {"example_id": "sum20-hist-ap-025-s1-e3", "text": "Все в цьому будинку .. витримано в суворих, трохи аж непривітних тонах ще тридцятих років – років перших п'ятирічок: суворі барви, суворі меблі", "source_ref": "П. Загребельний"}
      ],
      "cross_references": []
    },
    {
      "sense_id": "sum20-hist-ap-025-s2",
      "labels_source": ["розм."],
      "definition": "Те саме, що п'ятирі́ччя 1.",
      "examples": [
        {"example_id": "sum20-hist-ap-025-s2-e1", "text": "– Ми плануємо років за три завершити спорудження першого зразка [укриття], – знову почав доктор Ллан. – Додайте ще два роки, які підуть на його випробування. Всього лиш .. за п'ятирічку ви матимете сховище від усіх майбутніх катаклізмів", "source_ref": "А. Михайленко"},
        {"example_id": "sum20-hist-ap-025-s2-e2", "text": "Якось під час чергових відвідин цієї пари я наткнулася в кухонній шухляді на зошит із написом “План сімейного життя на наступну п'ятирічку”", "source_ref": "М. Матіос"}
      ],
      "cross_references": [{"relation": "same_as", "target_display": "п'ятирі́ччя 1"}]
    },
    {
      "sense_id": "sum20-hist-ap-025-s3",
      "labels_source": ["іст."],
      "definition": "Неповна середня школа в колишньому СРСР, у якій навчалися п'ять років.",
      "examples": [
        {"example_id": "sum20-hist-ap-025-s3-e1", "text": "У нас було чотири вчителі у школі. Тоді була тільки п'ятирічка; вже потім стала семирічка", "source_ref": "з мемуарної літ."},
        {"example_id": "sum20-hist-ap-025-s3-e2", "text": "Історія школи села Березівки Чернівецької області починається з церковно-приходської, побудованої в другій половині XIX ст. Потім вона була школою тільки для дівчаток, початковою, п'ятирічкою, семирічкою, дев'ятирічкою, а нині це одинадцятирічка", "source_ref": "із журн."}
      ],
      "cross_references": []
    }
  ],
  "phrases": []
}
