{
  "schema_version": "lex-entry-v0.4",
  "dataset_id": "sum20-hist-ap-pilot-v0",
  "entry_id": "sum20-hist-ap-012",
  "source": {"raw_path": "data/pilot/raw/012-etap.txt", "raw_sha256": "37a8100ae7abc01df34fc7235bfa0d14719c1e6fcf4f3ead2de21b7dc25bd394", "source_file": "4e21e575-8d98-4c3b-82a1-8f023a00d1ca.docx"},
  "lemma": {"display": "ЕТА́П", "search": "ЕТАП", "variants": []},
  "grammar": {"pos": "NOUN", "pos_status": "inferred_from_headword_morphology", "gender": "masculine", "gender_source": "ч.", "genitive_source": "у"},
  "def_short": "Окремий момент, період, стадія в розвитку чого-небудь, у якій-небудь діяльності.",
  "def_short_source_pointer": "/senses/0/definition",
  "senses": [
    {"sense_id": "sum20-hist-ap-012-s1", "labels_source": [], "definition": "Окремий момент, період, стадія в розвитку чого-небудь, у якій-небудь діяльності.", "examples": [
      {"example_id": "sum20-hist-ap-012-s1-e1", "text": "Сучасний театр причастився на вищому щаблі свого розвитку до вихідного свого джерела.., і далі перед ним стелиться шлях самоповторення, прискореного проходження знайомих уже етапів", "source_ref": "В. Підмогильний"},
      {"example_id": "sum20-hist-ap-012-s1-e2", "text": "Первісний імпульс бажання експерименту підганяв, і робот нарешті зважився. Він вирішив розділити задум на кілька етапів", "source_ref": "О. Бердник"}
    ], "cross_references": []},
    {"sense_id": "sum20-hist-ap-012-s2", "labels_source": [], "definition": "Окрема частина чого-небудь.", "examples": [
      {"example_id": "sum20-hist-ap-012-s2-e1", "text": "Перший етап нашого шляху кінчається. Венера сяє на чорному небозводі як ніколи раніше", "source_ref": "В. Владко"}
    ], "sub_senses": [
      {"sub_sense_id": "sum20-hist-ap-012-s2a", "labels_source": [], "definition": "Певна частина дистанції у спортивних змаганнях.", "examples": [{"example_id": "sum20-hist-ap-012-s2a-e1", "text": "От і тепер дивився тренер, як біжить Ярина четвертий етап, біжить швидко, навально, переможно", "source_ref": "В. Собко"}], "cross_references": []}
    ], "cross_references": []},
    {"sense_id": "sum20-hist-ap-012-s3", "labels_source": [], "definition": "Пункт на шляху пересування військ, де їм надається нічліг, продукти, медична допомога і т. ін.", "examples": [
      {"example_id": "sum20-hist-ap-012-s3-e1", "text": "Панові обер-лейтенанту відомо, що ми повинні були дістати їх [набої] аж на дальшому етапі перед позиціями", "source_ref": "С. Масляк, пер. з тв. Я. Гашека"},
      {"example_id": "sum20-hist-ap-012-s3-e2", "text": "Система етапного лікування з евакуацією за призначенням передбачала швидке доставлення пораненого на той етап, де йому могла бути надана спеціалізована медична допомога", "source_ref": "з наук. літ."}
    ], "cross_references": []},
    {"sense_id": "sum20-hist-ap-012-s4", "labels_source": [], "definition": "Пункт для ночівлі в дорозі груп засуджених.", "examples": [
      {"example_id": "sum20-hist-ap-012-s4-e1", "text": "Все рідше почали траплятись “етапи” – будівлі, де партія засуджених зупинялась на ночівлю", "source_ref": "О. Донченко"},
      {"example_id": "sum20-hist-ap-012-s4-e2", "text": "Етапи, заслання підірвали й до того слабе здоров'я Євгена Васильовича", "source_ref": "М. Олійник"},
      {"example_id": "sum20-hist-ap-012-s4-e3", "text": "Сорок вісім років прожив Устим Кармалюк. З них двадцять три – у боротьбі, по тюрмах та етапах, поза рідною землею, оселею", "source_ref": "з наук.-попул. літ."},
      {"example_id": "sum20-hist-ap-012-s4-e4", "text": "Присадкуваті мазанки повгрузали в землю, мов арештантські етапи", "source_ref": "О. Гончар", "labels_source": ["* У порівн."]}
    ], "sub_senses": [
      {"sub_sense_id": "sum20-hist-ap-012-s4a", "labels_source": [], "definition": "Група засуджених, яких відправляють куди-небудь під конвоєм.", "examples": [
        {"example_id": "sum20-hist-ap-012-s4a-e1", "text": "Незабаром старий москаль, що вів етап, скомандував у дорогу", "source_ref": "Панас Мирний"},
        {"example_id": "sum20-hist-ap-012-s4a-e2", "text": "Повільно відчинилася чорна брама – етап вирушив у тяжкий шлях", "source_ref": "С. Чорнобривець"},
        {"example_id": "sum20-hist-ap-012-s4a-e3", "text": "Начування, окрики, погрози за мною назирають звіддаля .. Мiдяногорла ремствує сурма. Iдуть етапи без кiнця, без краю", "source_ref": "В. Стус"}
      ], "cross_references": []},
      {"sub_sense_id": "sum20-hist-ap-012-s4b", "labels_source": [], "definition": "Шлях або частина шляху, яким засуджених відправляють під конвоєм до місця відбування покарання.", "examples": [
        {"example_id": "sum20-hist-ap-012-s4b-e1", "text": "Вихід в табори дорівнював порятункові, виходові на волю, і тому всі про це мріяли. Про етап. Етап у невідоме, в муку, але не в видиму смерть", "source_ref": "І. Багряний"},
        {"example_id": "sum20-hist-ap-012-s4b-e2", "text": "Ми сіли в чорну “Волгу”. Мене як пана везли в аеропорт Жуляни, ще не довіряючи звичайному залізничному етапу", "source_ref": "В. Рубан"}
      ], "cross_references": []}
    ], "cross_references": []},
    {"sense_id": "sum20-hist-ap-012-s5", "labels_source": ["у знач. присл."], "morphology_source": {"form": "ета́пом"}, "definition": "У супроводі озброєного загону; під конвоєм (про спосіб переправляння засуджених).", "examples": [
      {"example_id": "sum20-hist-ap-012-s5-e1", "text": "Закували коваля Єгора жандарми у залізні пута та й погнали етапом .. на Сибір", "source_ref": "І. Цюпа"},
      {"example_id": "sum20-hist-ap-012-s5-e2", "text": "– Ти, чоловіче, забувся, як тебе етапом у село пригнали?", "source_ref": "М. Стельмах"},
      {"example_id": "sum20-hist-ap-012-s5-e3", "text": "І шаблями їх страхали, і піками штрикали, і різок скуштувало десятеро, двох заарештували й етапом погнали до Києва", "source_ref": "Ю. Хорунжий"}
    ], "cross_references": []}
  ],
  "phrases": [
    {"phrase_id": "sum20-hist-ap-012-p1", "display": "Відправля́ти / відпра́вити на ета́п", "marker_source": "", "labels_source": [], "definition": null, "examples": [], "cross_references": [{"relation": "see", "target_display": "відправля́ти"}]},
    {"phrase_id": "sum20-hist-ap-012-p2", "display": "Пере́йдений (про́йдений) ета́п", "marker_source": "◇ (1)", "labels_source": [], "definition": "Що-небудь здійснене, опрацьоване, завершене.", "examples": [
      {"example_id": "sum20-hist-ap-012-p2-e1", "text": "– Що ж тобі прочитати? Книжок я з собою не захопив .. Кожна книжка, розумієш, – це вже перейдений етап", "source_ref": "І. Цюпа"},
      {"example_id": "sum20-hist-ap-012-p2-e2", "text": "Жартував [Борис], що коли Лялю оберуть ще кудись, то попередню її посаду обов'язково доручать йому, як Лялин “перейдений етап”", "source_ref": "О. Гончар"}
    ], "cross_references": []},
    {"phrase_id": "sum20-hist-ap-012-p3", "display": "По ета́пу", "marker_source": "(2)", "labels_source": ["іст."], "definition": "У супроводі озброєного загону; під конвоєм.", "examples": [
      {"example_id": "sum20-hist-ap-012-p3-e1", "text": "Володимирка – шлях до Сибіру. По етапу женуть нещасних", "source_ref": "О. Іваненко"},
      {"example_id": "sum20-hist-ap-012-p3-e2", "text": "Над деякими кримінальними нашвидкуруч закінчили слідство, винесли їм скорий вирок, відправили по етапу на каторгу", "source_ref": "Ю. Хорунжий"}
    ], "cross_references": []}
  ]
}
