{
  "schema_version": "lex-entry-v0.4",
  "dataset_id": "sum20-hist-ap-pilot-v0",
  "entry_id": "sum20-hist-ap-005",
  "source": {
    "raw_path": "data/pilot/raw/005-audytor.txt",
    "raw_sha256": "bad087ebd0ce5cf56d747e28b8ce6b937cc510e684f42ca68a490cae30ac3e59",
    "source_file": "4e21e575-8d98-4c3b-82a1-8f023a00d1ca.docx"
  },
  "lemma": {
    "display": "АУДИ́ТОР",
    "search": "АУДИТОР",
    "variants": [{"display": "АВДИ́ТОР", "labels_source": ["рідко"]}]
  },
  "grammar": {
    "pos": "NOUN",
    "pos_status": "inferred_from_headword_morphology",
    "gender": "masculine",
    "gender_source": "ч.",
    "genitive_source": "а"
  },
  "def_short": "Особа, яка здійснює перевірку стану фінансово-господарської діяльності якоїсь фірми чи компанії на основі контракту, укладеного з керівництвом компанії, і за спеціальним дозволом державних органів.",
  "def_short_source_pointer": "/senses/0/definition",
  "senses": [
    {
      "sense_id": "sum20-hist-ap-005-s1",
      "labels_source": [],
      "definition": "Особа, яка здійснює перевірку стану фінансово-господарської діяльності якоїсь фірми чи компанії на основі контракту, укладеного з керівництвом компанії, і за спеціальним дозволом державних органів.",
      "examples": [
        {"example_id": "sum20-hist-ap-005-s1-e1", "text": "Акціонерне товариство повинне для перевірки та підтвердження правильності річної фінансової звітності щорічно залучати аудитора, не пов'язаного майновими інтересами з товариством чи з його учасниками", "source_ref": "з мови документів"},
        {"example_id": "sum20-hist-ap-005-s1-e2", "text": "Аудиторами можуть виступати кваліфіковані спеціалісти, професіонали, які мають спеціальну ліцензію або які є працівниками аудиторських служб, фірм", "source_ref": "із журн."},
        {"example_id": "sum20-hist-ap-005-s1-e3", "text": "Аудитори також можуть давати оцінку очікуваним операціям, ступеня їхнього ризику, ефективності і т. ін.", "source_ref": "із журн."}
      ],
      "cross_references": []
    },
    {
      "sense_id": "sum20-hist-ap-005-s2",
      "labels_source": ["іст."],
      "definition": "Посада судового слідчого і прокурора у військово-судових закладах (у Російській імперії до 1917 р.).",
      "sub_senses": [{"sub_sense_id": "sum20-hist-ap-005-s2a", "definition": "Особа, яка обіймала таку посаду."}],
      "examples": [],
      "cross_references": []
    },
    {
      "sense_id": "sum20-hist-ap-005-s3",
      "labels_source": ["іст."],
      "definition": "Учень духовної семінарії, бурси і деяких громадянських навчальних закладів, який призначався учителем перевіряти завдання у своїх товаришів (у Російській імперії до 1917 р.).",
      "examples": [{"example_id": "sum20-hist-ap-005-s3-e1", "text": "Перевели мене в семінарію, зачув я волю. Дивлюсь, авдиторів немає, греки та латини валяються в нас під ліжками", "source_ref": "І. Нечуй-Левицький"}],
      "cross_references": []
    }
  ],
  "phrases": []
}
