{
  "schema_version": "lex-entry-v0.4",
  "dataset_id": "sum20-hist-ap-pilot-v0",
  "entry_id": "sum20-hist-ap-020",
  "source": {"raw_path": "data/pilot/raw/020-promysel.txt", "raw_sha256": "9c568730b238482ff779ffa595462ed079da359d45ceb4aa1b6ff9475245f9ab", "source_file": "4e21e575-8d98-4c3b-82a1-8f023a00d1ca.docx"},
  "lemma": {"display": "ПРО́МИСЕЛ", "search": "ПРОМИСЕЛ", "variants": []},
  "grammar": {"pos": "NOUN", "pos_status": "inferred_from_headword_morphology", "gender": "masculine", "gender_source": "ч.", "genitive_source": "слу"},
  "def_short": "Полювання на кого-, що-небудь, ловіння когось, чогось, збирання чогось і т. ін. для здобування продуктів тваринного чи рослинного походження.",
  "def_short_source_pointer": "/senses/0/definition",
  "senses": [
    {"sense_id": "sum20-hist-ap-020-s1", "labels_source": [], "definition": "Полювання на кого-, що-небудь, ловіння когось, чогось, збирання чогось і т. ін. для здобування продуктів тваринного чи рослинного походження.", "examples": [
      {"example_id": "sum20-hist-ap-020-s1-e1", "text": "Сюди [між Сулою та Ворсклою] влітку йшли на промисли – бити звіра, ловити рибу", "source_ref": "В. Малик"},
      {"example_id": "sum20-hist-ap-020-s1-e2", "text": "– Пішов [Сава Малахов] у тайгу на промисел – і нема. Він дядько досвідчений, заблукати просто так не міг", "source_ref": "А. Кокотюха"}
    ], "sub_senses": [
      {"sub_sense_id": "sum20-hist-ap-020-s1a", "labels_source": [], "definition": "Заняття яким-небудь ремеслом для добування засобів існування; дрібне ремісниче виробництво.", "examples": [
        {"example_id": "sum20-hist-ap-020-s1a-e1", "text": "Космач віддавна був селом лісових робітників. Іншого промислу в цих бідних горах не було", "source_ref": "Т. Масенко"},
        {"example_id": "sum20-hist-ap-020-s1a-e2", "text": "Художньо-різьбярський промисел у місті Косові і селі Річках дає значний, забарвлений радістю творчої праці заробіток багатьом сотням людей", "source_ref": "І. Волошин"},
        {"example_id": "sum20-hist-ap-020-s1a-e3", "text": "“Треба буде довідатися все про горілчаний промисел, – подумав гетьман. – І навести там лад”", "source_ref": "Ю. Мушкетик"}
      ], "cross_references": []},
      {"sub_sense_id": "sum20-hist-ap-020-s1b", "labels_source": ["розм."], "definition": "Заняття чим-небудь недозволеним, ганебним (крадіжкою, шахрайством і т. ін.).", "examples": [
        {"example_id": "sum20-hist-ap-020-s1b-e1", "text": "З ним ніхто не спілкувався, промислом злодійським займався одинцем", "source_ref": "М. Андрусяк"},
        {"example_id": "sum20-hist-ap-020-s1b-e2", "text": "– Схожий ти, чоловіче, на козака, а чомусь ординським промислом займаєшся? – звернувся до Волоха Остап", "source_ref": "Д. Білий"},
        {"example_id": "sum20-hist-ap-020-s1b-e3", "text": "Його промисел був махлювати, підробляти підписи, збувати крадені банкноти й таке інше", "source_ref": "Р. Доценко, пер. з тв. Ч. Дікенса"}
      ], "cross_references": []}
    ], "cross_references": []},
    {"sense_id": "sum20-hist-ap-020-s2", "labels_source": [], "definition": "Місце, родовище, де добувають що-небудь; добувне промислове підприємство.", "examples": [
      {"example_id": "sum20-hist-ap-020-s2-e1", "text": "Вони [експлуататори] захоплюють у свої руки промисли, ставлять фабрики, як павук павутиння, скрізь розстелюють свої сіті", "source_ref": "М. Коцюбинський"},
      {"example_id": "sum20-hist-ap-020-s2-e2", "text": "Адміністрація змушена вирубувати ліси навколо промислів і виставляти посилені військові патрулі", "source_ref": "Ю. Бедзик"},
      {"example_id": "sum20-hist-ap-020-s2-e3", "text": "Я .. знайшов у ріці .. золото .. Коли цей промисел розрісся, жупанат прибрав його до своїх рук", "source_ref": "М. Дочинець"}
    ], "sub_senses": [
      {"sub_sense_id": "sum20-hist-ap-020-s2a", "labels_source": [], "definition": "Галузь промислового виробництва.", "examples": [
        {"example_id": "sum20-hist-ap-020-s2a-e1", "text": "На рибальському улові й урожаях овочівників постав консервний промисел", "source_ref": "Ю. Смолич"},
        {"example_id": "sum20-hist-ap-020-s2a-e2", "text": "– Льодовий промисел дуже високо цінять та шанують і за кордоном, бо це прибуткове підприємство, хоч, правда, і небезпечне", "source_ref": "С. Масляк, пер. з тв. Я. Гашека"}
      ], "cross_references": []}
    ], "cross_references": []},
    {"sense_id": "sum20-hist-ap-020-s3", "labels_source": ["заст."], "definition": "Бойові дії проти ворога; служба в армії.", "examples": [
      {"example_id": "sum20-hist-ap-020-s3-e1", "text": "Посли били чолом государеві, аби він і далі наказував війську своєму шляхту польську воювати і промисел чинити на півдні", "source_ref": "Н. Рибак"},
      {"example_id": "sum20-hist-ap-020-s3-e2", "text": "В родовому архіві Стадницьких документально значилось, що Володимир Стадник військовим промислом доскочив дворянського герба і достоїнства", "source_ref": "М. Стельмах"},
      {"example_id": "sum20-hist-ap-020-s3-e3", "text": "Ті, що, не замислюючись, потяли двадцять тисяч полонених.., не стануть вагатися, зберуться з силою й підуть на ратні промисли до сусідів", "source_ref": "Д. Міщенко"}
    ], "cross_references": []}
  ],
  "phrases": [
    {"phrase_id": "sum20-hist-ap-020-p1", "display": "Бо́ртний про́мисел", "marker_source": "(1)", "labels_source": ["заст."], "definition": "Лісове бджільництво.", "examples": [{"example_id": "sum20-hist-ap-020-p1-e1", "text": "У період Х–ХIII ст. переважною формою видобутку меду був бортний промисел, тобто отримання меду від диких бджіл", "source_ref": "з наук. літ."}], "cross_references": []},
    {"phrase_id": "sum20-hist-ap-020-p2", "display": "Відхідни́й (відхо́жий) про́мисел", "marker_source": "△ (2)", "labels_source": ["іст."], "definition": "Сезонна робота, на яку йшли селяни, залишаючи тимчасово своє господарство.", "examples": [
      {"example_id": "sum20-hist-ap-020-p2-e1", "text": "Вирушають [молоді люди] .. на відхожий промисел до Харкова й до інших міст", "source_ref": "А. Шиян"},
      {"example_id": "sum20-hist-ap-020-p2-e2", "text": "У виробничих селищах із легкими наземними будівлями та господарськими ямами біля села Лапутьки жителі сусідніх городищенських центрів займалися відхідним промислом", "source_ref": "з наук. літ."}
    ], "cross_references": []},
    {"phrase_id": "sum20-hist-ap-020-p3", "display": "Про́мисел Бо́жий", "marker_source": "◇ (3)", "labels_source": [], "definition": "Заступництво, дії Божої сили, Бога; провиді́ння.", "examples": [
      {"example_id": "sum20-hist-ap-020-p3-e1", "text": "Стріляв у царя якийсь Соловйов. – Кажуть, п'ять куль випустив, – говорив Арсен Федорович. – І воістину лише промисел Божий врятував государя", "source_ref": "В. Канівець"},
      {"example_id": "sum20-hist-ap-020-p3-e2", "text": "– Не дано нам пізнати промисел Божий ні щодо нас, ні щодо цього світу. У кожного в цьому світі є своє призначення. Вірити треба, просто вірити", "source_ref": "В. Лис"}
    ], "cross_references": []}
  ]
}
