{
  "schema_version": "lex-entry-v0.4",
  "dataset_id": "sum20-hist-ap-pilot-v0",
  "entry_id": "sum20-hist-ap-003",
  "source": {
    "raw_path": "data/pilot/raw/003-akt.txt",
    "raw_sha256": "59426efa5dab99ba2ccb3a47e1298319f65810c2728c73d2610a3fe65e7bebdc",
    "source_file": "4e21e575-8d98-4c3b-82a1-8f023a00d1ca.docx"
  },
  "lemma": {"display": "АКТ", "search": "АКТ", "variants": []},
  "grammar": {"pos": "NOUN", "pos_status": "inferred_from_headword_morphology", "gender": "masculine", "gender_source": "ч."},
  "def_short": "Окремий вияв якої-небудь діяльності або якогось процесу; дія, подія, вчинок.",
  "def_short_source_pointer": "/senses/0/definition",
  "senses": [
    {
      "sense_id": "sum20-hist-ap-003-s1",
      "labels_source": [],
      "morphology_source": {"genitive": "у"},
      "definition": "Окремий вияв якої-небудь діяльності або якогось процесу; дія, подія, вчинок.",
      "examples": [
        {"example_id": "sum20-hist-ap-003-s1-e1", "text": "Вольові акти завжди спираються на вміння, навички особистості", "source_ref": "з наук. літ."},
        {"example_id": "sum20-hist-ap-003-s1-e2", "text": "Обрядовість сватання на Бойківщині була важливим громадським актом, який передував шлюбу і санкціонував його", "source_ref": "з наук.-попул. літ."}
      ],
      "sub_senses": [
        {
          "sub_sense_id": "sum20-hist-ap-003-s1a",
          "definition": "Окрема дія, поодинокий вчинок.",
          "examples": [{"example_id": "sum20-hist-ap-003-s1a-e1", "text": "Тепер приходить їхня черга! Було кожному ясно, що починався головний акт великої трагедії", "source_ref": "І. Багряний"}]
        }
      ],
      "cross_references": []
    },
    {
      "sense_id": "sum20-hist-ap-003-s2",
      "labels_source": [],
      "morphology_source": {"genitive": "у"},
      "definition": "Закінчена частина театральної вистави, драматичного твору; дія.",
      "examples": [
        {"example_id": "sum20-hist-ap-003-s2-e1", "text": "Була й новинка Карпенкова – “Суєта”. Перші три акти добрі", "source_ref": "Панас Мирний"},
        {"example_id": "sum20-hist-ap-003-s2-e2", "text": "Найбільш театральна драматична поема “У пущі”, хоча в останньому акті драматизм понижується", "source_ref": "М. Драй-Хмара"}
      ],
      "cross_references": []
    },
    {
      "sense_id": "sum20-hist-ap-003-s3",
      "labels_source": [],
      "morphology_source": {"genitive": "а"},
      "definition": "Указ, постанова і т. ін. державного, суспільного значення.",
      "examples": [
        {"example_id": "sum20-hist-ap-003-s3-e1", "text": "[Анна:] А хутко я вам подарую інакший [перстень], щоб печаті прикладати до командорських актів", "source_ref": "Леся Українка"},
        {"example_id": "sum20-hist-ap-003-s3-e2", "text": "Акт незалежності – це продовження і реальна дія Декларації про державний суверенітет України, логічний підсумок усього суспільного розвитку останніх років", "source_ref": "з газ."}
      ],
      "sub_senses": [
        {
          "sub_sense_id": "sum20-hist-ap-003-s3a",
          "definition": "Офіційний документ, протокол, запис про який-небудь факт наявності або відсутності чогось.",
          "examples": [
            {"example_id": "sum20-hist-ap-003-s3a-e1", "text": "Сів голова на своє місце за столом, звелів рахівникові акта скласти", "source_ref": "А. Головко"},
            {"example_id": "sum20-hist-ap-003-s3a-e2", "text": "Здоровань-лісничий заставив скидати стояки на те саме місце, звідки вони були взяті, склав акта і поїхав геть", "source_ref": "Григорій Тютюнник"}
          ]
        }
      ],
      "cross_references": []
    },
    {
      "sense_id": "sum20-hist-ap-003-s4",
      "labels_source": ["заст."],
      "morphology_source": {"genitive": "у"},
      "definition": "Урочисті збори у шкільному закладі або в науковій установі у зв'язку з закінченням навчального року, врученням нагород і т. ін.",
      "examples": [
        {"example_id": "sum20-hist-ap-003-s4-e1", "text": "Другого дня в школі був акт", "source_ref": "С. Васильченко"},
        {"example_id": "sum20-hist-ap-003-s4-e2", "text": "На випускному акті його урочисто вітали викладачі", "source_ref": "П. Колесник"}
      ],
      "cross_references": []
    }
  ],
  "phrases": [
    {
      "phrase_id": "sum20-hist-ap-003-p1",
      "display": "А́кти циві́льного (громадя́нського) ста́ну",
      "marker_source": "(1)",
      "labels_source": [],
      "definition": "Записи спеціальними державними органами фактів народження, смерті, шлюбу, розлучення і т. ін.",
      "examples": [
        {"example_id": "sum20-hist-ap-003-p1-e1", "text": "Акти цивільного стану відбивають зміни обставин в особистому житті громадянина", "source_ref": "з наук. літ."},
        {"example_id": "sum20-hist-ap-003-p1-e2", "text": "Адміністративна реалізація заяв про зміну прізвища – компетенція органів реєстрації актів громадянського стану", "source_ref": "з навч. літ."}
      ]
    },
    {
      "phrase_id": "sum20-hist-ap-003-p2",
      "display": "Акт реві́зії",
      "marker_source": "(2)",
      "labels_source": [],
      "definition": "Офіційний документ про результати перевірки фінансово-господарської діяльності підприємства, організації, установи або посадових осіб за певний період.",
      "examples": [{"example_id": "sum20-hist-ap-003-p2-e1", "text": "В акті ревізії вказуються виявлені недоліки в роботі, допущені посадовими особами порушення законодавства та зловживання, а також відмічаються позитивні моменти й досягнення в роботі, які заслуговують бути розповсюдженими", "source_ref": "з навч. літ."}]
    },
    {
      "phrase_id": "sum20-hist-ap-003-p3",
      "display": "Терористи́чний акт",
      "marker_source": "(3)",
      "labels_source": [],
      "definition": "Убивство чи замах на життя особи чи осіб або які-небудь злочинні дії у значних масштабах, спрямовані на підрив, загострення становища в країні, суспільстві або міждержавних відносинах.",
      "examples": [
        {"example_id": "sum20-hist-ap-003-p3-e1", "text": "Тим часом Валер'ян Осинський .. замислив свій перший терористичний акт", "source_ref": "Ю. Хорунжий"},
        {"example_id": "sum20-hist-ap-003-p3-e2", "text": "Терористичні акти проти феодалів і злодійство були в центрі уваги законодавства Київської Русі", "source_ref": "з наук. літ."}
      ]
    },
    {
      "phrase_id": "sum20-hist-ap-003-p4",
      "display": "Ді́льчий акт",
      "marker_source": "△ (4)",
      "labels_source": ["іст."],
      "definition": "Юридично оформлений документ про поділ, відокремлення майна.",
      "examples": [{"example_id": "sum20-hist-ap-003-p4-e1", "text": "Перші дослідження історії Острозької волості спиралися майже виключно на описово-статистичні джерела (дільчі акти, інвентарі, податкові реєстри)", "source_ref": "з наук. літ."}]
    },
    {
      "phrase_id": "sum20-hist-ap-003-p5",
      "display": "Нормати́вний акт",
      "marker_source": "(5)",
      "labels_source": ["політ.", "юр."],
      "definition": "Документ компетентного органу державної влади, яким установлюються норми права.",
      "examples": [
        {"example_id": "sum20-hist-ap-003-p5-e1", "text": "Майнова відповідальність сторін регулюється нормативними актами, встановленими чинним законодавством", "source_ref": "з навч. літ."},
        {"example_id": "sum20-hist-ap-003-p5-e2", "text": "Законодавчі та інші нормативні акти, що стосуються прав, свобод і законних інтересів громадян, не доведені до публічного відома, не мають юридичної сили", "source_ref": "з мови документів"}
      ]
    }
  ]
}
