{
  "schema_version": "lex-entry-v0.4",
  "dataset_id": "sum20-hist-ap-pilot-v0",
  "entry_id": "sum20-hist-ap-004",
  "source": {
    "raw_path": "data/pilot/raw/004-arkhetyp.txt",
    "raw_sha256": "4329da53332613482e069bb8ea5fd1ae413e8d0301a59309318e19b5b1e52754",
    "source_file": "4e21e575-8d98-4c3b-82a1-8f023a00d1ca.docx"
  },
  "lemma": {"display": "АРХЕТИ́П", "search": "АРХЕТИП", "variants": []},
  "grammar": {
    "pos": "NOUN",
    "pos_status": "inferred_from_headword_morphology",
    "gender": "masculine",
    "gender_source": "ч.",
    "genitive_source": "у"
  },
  "def_short": "Універсальні первинні уроджені психічні структури, що становлять зміст колективного безсвідомого.",
  "def_short_source_pointer": "/senses/0/definition",
  "senses": [
    {
      "sense_id": "sum20-hist-ap-004-s1",
      "labels_source": ["псих.", "філос."],
      "definition": "Універсальні первинні уроджені психічні структури, що становлять зміст колективного безсвідомого.",
      "examples": [{"example_id": "sum20-hist-ap-004-s1-e1", "text": "В аналітичній психології К.-Г. Юнга архетипи як універсальні психічні структури, образи (мотиви) є основою загальнолюдської символіки сновидінь, міфів, казок та інших утворень фантазії", "source_ref": "з навч. літ."}],
      "cross_references": []
    },
    {
      "sense_id": "sum20-hist-ap-004-s2",
      "labels_source": ["іст."],
      "definition": "Первинний, найдревніший текст, з якого, ймовірно, походять інші тексти писемної пам'ятки.",
      "examples": [{"example_id": "sum20-hist-ap-004-s2-e1", "text": "Вважалось, що вивчення рукописів обмежується діставанням тексту пам'ятки, найближчого до авторського оригіналу (або архетипу), який має бути основою видання", "source_ref": "з наук. літ."}],
      "cross_references": []
    },
    {
      "sense_id": "sum20-hist-ap-004-s3",
      "labels_source": ["лінгв."],
      "definition": "Вихідна первинна мовна форма, реконструйована на основі зіставлення реально існуючих мовних фактів, що належать до різних мов.",
      "examples": [{"example_id": "sum20-hist-ap-004-s3-e1", "text": "Спецкурси дають змогу студентам ознайомитися з окремими аспектами сучасних лінгвістичних теорій і методологій (наприклад, феноменологією, герменевтикою, теорією архетипів)", "source_ref": "з наук. літ."}],
      "cross_references": []
    }
  ],
  "phrases": []
}
